Class	Level	Name	School	Casting Time	Range	Components	Duration	Description		
Fighter (Eldritch Knight)	0	Dancing Lights	Evocation cantrip	1 action	120 feet	V, S, M	Concentration, up to 1 minute	You create up to four torch-sized lights within range, making them appear as torches, lanterns, or glowing orbs that hover in the air for the duration. You can also combine the four lights into one glowing vaguely humanoid form of Medium size. Whichever form you choose, each light sheds dim light in a 10-foot radius.<br> As a bonus action on your turn, you can move the lights up to 60 feet to a new spot within range. A light must be within 20 feet of another light created by this spell, and a light winks out if it exceeds the spell's range.		
Fighter (Eldritch Knight)	0	Fire Bolt	Evocation cantrip	1 action	120 feet	V, S	Instantaneous	You hurl a mote of fire at a creature or object within range. Make a ranged spell attack against the target. On a hit, the target takes 1d10 fire damage. A flammable object hit by this spell ignites if it isn't being worn or carried.<br> This spell's damage increases by 1d10 when you reach 5th level (2d10), 11th level (3d10), and 17th level (4d10).		
Fighter (Eldritch Knight)	0	Light	Evocation cantrip	1 action	Touch	V, M	1 hour	(a firefly or phosphorescent moss)You touch one object that is no larger than 10 feet in any dimension. Until the spell ends, the object sheds bright light in a 20-foot radius and dim light for an additional 20 feet. The light can be colored as you like. Completely covering the object with something opaque blocks the light. The spell ends if you cast it again or dismiss it as an action.<br> If you target an object held or worn by a hostile creature, that creature must succeed on a Dexterity saving throw to avoid the spell.		
Fighter (Eldritch Knight)	0	Ray of Frost	Evocation cantrip	1 action	60 feet	V, S	Instantaneous	A frigid beam of blue-white light streaks toward a creature within range. Make a ranged spell attack against the target. On a hit, it takes 1d8 cold damage, and its speed is reduced by 10 feet until the start of your next turn.<br> The spell's damage increases by 1d8 when you reach 5th level (2d8), 11th level (3d8), and 17th level (4d8).		
Fighter (Eldritch Knight)	0	Shocking Grasp	Evocation cantrip	1 action	Touch	V, S	Instantaneous	Lightning springs from your hand to deliver a shock to a creature you try to touch. Make a melee spell attack against the target. You have advantage on the attack roll if the target is wearing armor made of metal. On a hit, the target takes 1d8 lightning damage, and it can't take reactions until the start of its next turn.<br> The spell's damage increases by 1d8 when you reach 5th level (2d8), 11th level (3d8), and 17th level (4d8).		
Fighter (Eldritch Knight)	0	Blade Ward	Abjuration cantrip	1 action	Self	V, S	1 round	You extend your hand and trace a sigil of warding in the air. Until the end of your next turn, you have resistance against bludgeoning, piercing, and slashing damage dealt by weapon attacks.		
Fighter (Eldritch Knight)	1	Burning Hands	1st level Evocation	1 action	Self (15-foot cone)	V, S	Instantaneous	As you hold your hands with thumbs touching and fingers spread, a thin sheet of flames shoots forth from your outstretched fingertips. Each creature in a 15-foot cone must make a Dexterity saving throw. A creature takes 3d6 fire damage on a failed save, or half as much damage on a successful one.<br> The fire ignites any flammable objects in the area that aren't being worn or carried. At Higher Levels: When you cast this spell using a spell slot of 2nd level or higher, the damage increases by 1d6 for each slot level above 1st.		
Fighter (Eldritch Knight)	1	Chromatic Orb	1st level Evocation	1 action	90 feet	V, S, M	Instantaneous	(a diamond worth at least 50 gp)You hurl a 4-inch-diameter sphere of energy at a creature that you can see within range. You choose acid, cold, fire, lightning, poison, or thunder for the type of orb you create, and then make a ranged spell attack against the target. If the attack hits, the creature takes 3d8 damage of the type you chose. At Higher Levels: When you cast this spell using a spell slot of or higher, the damage increases by 1d8 for each slot level above 1st.<br> At Higher Levels: When you cast this spell using a spell slot of 2nd level or higher, the damage increases by 1d8 for each slot level above 1st.		
Fighter (Eldritch Knight)	1	Magic Missile	1st level Evocation	1 action	120 feet	V, S	Instantaneous	You create three glowing darts of magical force. Each dart hits a creature of your choice that you can see within range. A dart deals 1d4+1 force damage to its target. The darts all strike simultaneously and you can direct them to hit one creature or several.<br> At Higher Levels: When you cast this spell using a spell slot of 2nd level or higher, the spell creates one more dart for each slot above 1st.		
Fighter (Eldritch Knight)	1	Thunderwave	1st level Evocation	1 action	Self (15-foot cube)	V, S	Instantaneous	A wave of thunderous force sweeps out from you. Each creature in a 15-foot cube originating from you must make a Constitution saving throw. On a failed save, a creature takes 2d8 thunder damage and is pushed 10 feet away from you. On a successful save, the creature takes half as much damage and isn't pushed.<br> In addition, unsecured objects that are completely within the area of effect are automatically pushed 10 feet away from you by the spell's effect, and the spell emits a thunderous boom audible out to 300 feet. At Higher Levels: When you cast this spell using a spell slot of 2nd level or higher, the damage increases by 1d8 for each slot level above 1st.		
Fighter (Eldritch Knight)	1	Witch Bolt	1st level Evocation	1 action	30 feet	V, S, M	Concentration, up to 1 minute	(a twig from a tree that has been struck by lightning)A beam of crackling, blue energy lances out toward a creature within range, forming a sustained arc of lightning between you and the target. Make a ranged spell attack against that creature. On a hit, the target takes 1d12 lightning damage, and on each of your turns for the duration, you can use your action to deal 1d12 lightning damage to the target automatically. The spell ends if you use your action to do anything else. The spell also ends if the target is ever outside the spell's range or if it has total cover from you.<br> At Higher Levels: When you cast this spell using a spell slot of 2nd level or higher, the initial damage increases by 1d12 for each slot level above 1st.		
Fighter (Eldritch Knight)	1	Alarm (ritual)	1st level Abjuration	1 minute	30 feet	V, S, M	8 hours	(a tiny bell and a piece of fine silver wire)You set an alarm against unwanted intrusion. Choose a door, a window, or an area within range that is no larger than a 20-foot cube. Until the spell ends, an alarm alerts you whenever a tiny or larger creature touches or enters the warded area. When you cast the spell, you can designate creatures that won't set off the alarm. You also choose whether the alarm is mental or audible.<br> A mental alarm alerts you with a ping in your mind if you are within 1 mile of the warded area. This ping awakens you if you are sleeping. An audible alarm produces the sound of a hand bell for 10 seconds within 60 feet.		
Fighter (Eldritch Knight)	1	Mage Armor	1st level Abjuration	1 action	Touch	V, S, M	8 hours	(a piece of cured leather)You touch a willing creature who isn't wearing armor, and a protective magical force surrounds it until the spell ends. The target's base AC becomes 13 + its Dexterity modifier. The spell ends it if the target dons armor or if you dismiss the spell as an action.		
Fighter (Eldritch Knight)	1	Protection from Evil and Good	1st level Abjuration	1 action	Touch	V, S, M	Concentration, up to 10 minutes	(holy water or powdered silver and iron, which the spell consumes)Until the spell ends, one willing creature you touch is protected against certain types of creatures - aberrations, celestials, elementals, fey, fiends, and undead.<br> The protection grants several benefits. Creatures of those types have disadvantage on attack rolls against the target. The target also can't be charmed, frightened, or possessed by them. If the target is already charmed, frightened, or possessed by such a creature, the target has advantage on any new saving throw against the relevant effect.		
Fighter (Eldritch Knight)	1	Shield	1st level Abjuration	1 reaction	Self	V, S	1 round	An invisible barrier of magical force appears and protects you. Until the start of your next turn, you have a +5 bonus to AC, including against the triggering attack, and you take no damage from magic missile.		
Fighter (Eldritch Knight)	2	Continual Flame	2nd level Evocation	1 action	Touch	V, S, M	Until dispelled	(ruby dust worth 50 gp, which the spell consumes)A flame, equivalent in brightness to a torch, springs forth from an object that you touch. The effect looks like a regular flame, but it creates no heat and doesn't use oxygen. A continual flame can be covered or hidden but not smothered or quenched.		
Fighter (Eldritch Knight)	2	Darkness	2nd level Evocation	1 action	60 feet	V, M	Concentration, up to 10 minutes	(bat fur and a drop of pitch or piece of coal)Magical darkness spreads from a point you choose within range to fill a 15-foot radius sphere for the duration. The darkness spreads around corners. A creature with darkvision can't see through this darkness, and nonmagical light can't illuminate it.<br> If the point you choose is on an object you are holding or one that isn't being worn or carried, the darkness emanates from the object and moves with it. Completely covering the source of the darkness with an opaque object, such as a bowl or a helm, blocks the darkness. If any of this spell's area overlaps with an area of light created by a spell of or lower, the spell that created the light is dispelled.		
Fighter (Eldritch Knight)	2	Gust of Wind	2nd level Evocation	1 action	Self (60-foot line)	V, S, M	Concentration, up to 1 minute	(a legume seed)A line of strong wind 60 feet long and 10 feet wide blasts from you in a direction you choose for the spell's duration. Each creature that starts its turn in the line must succeed on a Strength saving throw or be pushed 15 feet away from you in a direction following the line.<br> Any creature in the line must spend 2 feet of movement for every 1 foot it moves when moving closer to you. The gust disperses gas or vapor, and it extinguishes candles, torches, and similar unprotected flames in the area. It causes protected flames, such as those of lanterns, to dance wildly and has a 50 percent chance to extinguish them. As a bonus action on each of your turns before the spell ends, you can change the direction in which the line blasts from you.		
Fighter (Eldritch Knight)	2	Scorching Ray	2nd level Evocation	1 action	120 feet	V, S	Instantaneous	You create three rays of fire and hurl them at targets within range. You can hurl them at one target or several.<br> Make a ranged spell attack for each ray. On a hit, the target takes 2d6 fire damage. At Higher Levels: When you cast this spell using a spell slot of 3rd level or higher, you create one additional ray for each slot level above 2nd.		
Fighter (Eldritch Knight)	2	Shatter	2nd level Evocation	1 action	60 feet	V, S, M	Instantaneous	(a chip of mica)A sudden loud ringing noise, painfully intense, erupts from a point of your choice within range. Each creature in a 10-foot-radius sphere centered on that point must make a Constitution saving throw. A creature takes 3d8 thunder damage on a failed save, or half as much damage on a successful one. A creature made of inorganic material such as stone, crystal, or metal has disadvantage on this saving throw.<br> A nonmagical object that isn't being worn or carried also takes the damage if it's in the spell's area. At Higher Levels: When you cast this spell using a spell slot of or higher, the damage increases by 1d8 for each slot level above 2nd.		
Fighter (Eldritch Knight)	2	Arcane Lock	2nd level Abjuration	1 action	Touch	V, S, M	Until dispelled	(gold dust worth at least 25 gp, which the spell consumes)You touch a closed door, window, gate, chest, or other entryway, and it becomes locked for the duration. You and the creatures you designate when you cast this spell can open the object normally. You can also set a password that, when spoken within 5 feet of the object, suppresses this spell for 1 minute. Otherwise, it is impassable until it is broken or the spell is dispelled or suppressed. Casting knock on the object suppresses arcane lock for 10 minutes.<br> While affected by this spell, the object is more difficult to break or force open		Wizard
Fighter (Eldritch Knight)	3	Fireball	3rd level Evocation	1 action	150 feet	V, S, M	Instantaneous	(a tiny ball of bat guano and sulfur)A bright streak flashes from your pointing finger to a point you choose within range then blossoms with a low roar into an explosion of flame. Each creature in a 20-foot radius must make a Dexterity saving throw. A target takes 8d6 fire damage on a failed save, or half as much damage on a successful one.<br> The fire spreads around corners. It ignites flammable objects in the area that aren't being worn or carried. At Higher Levels: When you cast this spell using a spell slot of 4th level or higher, the damage increases by 1d6 for each slot level above 3rd.		
Fighter (Eldritch Knight)	3	Lightning Bolt	3rd level Evocation	1 action	Self (100-foot line)	V, S, M	Instantaneous	(a bit of fur and a rod of amber, crystal, or glass)A stroke of lightning forming a line of 100 feet long and 5 feet wide blasts out from you in a direction you choose. Each creature in the line must make a Dexterity saving throw. A creature takes 8d6 lightning damage on a failed save, or half as much damage on a successful one.<br> The lightning ignites flammable objects in the area that aren't being worn or carried. At Higher Levels: When you cast this spell using a spell slot of 4th level or higher, the damage increases by 1d6 for each slot above 3rd.		
Fighter (Eldritch Knight)	3	Sending	3rd level Evocation	1 action	Unlimited	V, S, M	1 round	(A short piece of fine copper wire)You send a short message of twenty-five words or less to a creature with you are familiar. The creature hears the message in its mind, recognizes you as the sender if it knows you, and can answer in a like manner immediately. The spell enables creatures with Intelligence scores of at least 1 to understand the meaning of your message.<br> You can send the message across any distance and even to other planes of existence, but if the target is on a different plane than you, there is a 5 percent chance that the message doesn't arrive.		
Fighter (Eldritch Knight)	3	Counterspell	3rd level Abjuration	1 reaction	60 feet	S	Instantaneous	You attempt to interrupt a creature in the process of casting a spell. If the creature is casting a spell of 3rd level or lower, its spell fails and has no effect. If it is casting a spell of 4th level or higher, make an ability check using your spellcasting ability. The DC equals 10 + the spell's level. On a success, the creature's spell fails and has no effect.<br> At Higher Level. When you cast this spell using a spell slot of 4th level or higher, the interrupted spell has no effect if its level is less than or equal to the level of the spell slot you used.		
Fighter (Eldritch Knight)	3	Dispel Magic	3rd level Abjuration	1 action	120 feet	V, S	Instantaneous	Choose any creature, object, or magical effect within range. Any spell of 3rd level or lower on the target ends. For each spell of or higher on the target, make an ability check using your spellcasting ability. The DC equals 10 + the spell's level. On a successful check, the spell ends.<br> At Higher Levels: When you cast this spell using a spell slot of 4th level or higher, you automatically end the effects of a spell on the target if the spell's level is equal to or less than the level of the spell slot you used.		
Fighter (Eldritch Knight)	3	Glyph of Warding	3rd level Abjuration	1 hour	Touch	V, S, M	Until dispelled or triggered	(incense and powdered diamond worth at least 200 gp, which the spell consumes)When you cast this spell, you inscribe a glyph that harms other creatures, either upon a surface (such as a table or a section of floor or wall) or within an object that can be closed (such as a book, a scroll, or a treasure chest) to conceal the glyph. If you choose a surface, the glyph can cover an area of the surface no larger than 10 feet in diameter. If you choose an object, that object must remain in its place, if the object is moved more than 10 feet from where you cast this spell, the glyph is broken and the spell ends without being triggered.<br> The glyph is nearly invisible and requires a successful Intelligence (Investigation) check against your spell save DC to be found. You decide what triggers the glyph when you cast the spell. For glyphs inscribed on a surface, the most typical triggers include touching or standing on the glyph, removing another object covering the glyph, approaching within a certain distance of the glyph, or manipulating the object on which the glyph is inscribed. For glyphs inscribed within an object, the most common triggers include opening that object, approaching within a certain distance of the object, or seeing or reading the glyph. Once a glyph is triggered, this spell ends. You can further refine the trigger so the spell activates only under certain circumstances or according to physical characteristics (such as height or weight), creature kind (for example, the ward could be set to affect aberrations or drow), or alignment. You can also set conditions for creatures that don't trigger the glyph, such as those who say a certain password. When you inscribe the glyph, choose explosive runes or a spell glyph. Explosive Runes: When triggered, the glyph erupts with magical energy in a 20-foot-radius sphere centered on the glyph. The sphere spreads around corners. Each creature in the aura must make a Dexterity saving throw. A creature takes 5d8 acid, cold, fire, lightning, or thunder damage on a failed saving throw (your choice when you create the glyph), or half as much damage on a successful one. Spell Glyph: You can store a prepared spell of or lower in the glyph by casting it as part of creating the glyph. The spell must target a single creature or an area. The spell being stored has no immediate effect when cast in this way. When the glyph is triggered, the stored spell is cast. If the spell has a target, it targets the creature that triggered the glyph. If the spell affects an area, the area is centered on that creature. If the spell summons hostile creatures or creates harmful objects or traps, they appear as close as possible to the intruder and attack it. If the spell requires concentration, it lasts until the end of its full duration. At Higher Levels: When you cast this spell using a spell slot of 4th level or higher, the damage of an explosive runes glyph increases by 1d8 for each slot level above 3rd. If you create a spell glyph, you can store any spell of up to the same level as the slot you use for the glyph of warding.		
Fighter (Eldritch Knight)	3	Magic Circle	3rd level Abjuration	1 minute	10 feet	V, S, M	1 hour	(holy water or powdered silver and iron worth at least 100 gp, which the spell consumes)You create a 10-foot-radius, 20-foot-tall cylinder of magical energy centered on a point on the ground that you can see within range. Glowing runes appear wherever the cylinder intersects with the floor or other surface.<br> Choose one or more of the following types of creatures - celestials, elementals, fey, fiends, or undead. The circle affects a creature of the chosen type in the following ways. • The creature can't willingly enter the cylinder by nonmagical means. If the creature tries to use teleportation or interplanar travel to do so, it must first succeed on a Charisma saving throw. • The creature has disadvantage on attack rolls against targets within the cylinder. • Targets within the cylinder can't be charmed, frightened, or possessed by the creature. When you cast this spell, you can elect to cause its magic to operate in the reverse direction, preventing a creature of the specified type from leaving the cylinder and protecting targets outside it. At Higher Levels: When you cast this spell using a spell slot of 4th level or higher, the duration increases by 1 hour for each slot level above 3rd.		
Fighter (Eldritch Knight)	3	Nondetection	3rd level Abjuration	1 action	Touch	V, S, M	8 hours	(a pinch of diamond dust worth 25 gp sprinkled over the target, which the spell consumes)For the duration, you hide a target that you touch from divination magic. The target can be a willing creature or a place or an object no larger than 10 feet in any dimension. The target can't be targeted by any divination magic or perceived through magical scrying sensors.		
Fighter (Eldritch Knight)	3	Protection from Energy	3rd level Abjuration	1 action	Touch	V, S	Concentration, up to 1 hour	For the duration, the willing creature you touch has resistance to one damage type of your choice - acid, cold, fire, lightning, or thunder.		
Fighter (Eldritch Knight)	3	Remove Curse	3rd level Abjuration	1 action	Touch	V, S	Instantaneous	At your touch, all curses affecting one creature or object end. If the object is a cursed magic item, its curse remains, but the spell breaks its owner's attunement to the object so it can be removed or discarded.		
Fighter (Eldritch Knight)	4	Fire Shield	4th level Evocation	1 action	Self	V, S, M	10 minutes	(a bit of phosphorous or a firefly)Thin and wispy flames wreathe your body for the duration, shedding bright light in a 10-foot radius and dim light for an additional 10 feet. You can end the spell early by using an action to dismiss it.<br> The flames provide you with a warm shield or a chill shield, as you choose. The warm shield grants you resistance to cold damage, and the chill shield grants you resistance to fire damage. In addition, whenever a creature within 5 feet of you hits you with a melee attack, the shield erupts with flame. The attacker takes 2d8 fire damage from a warm shield, or 2d8 cold damage from a cold shield.		
Fighter (Eldritch Knight)	4	Ice Storm	4th level Evocation	1 action	300 feet	V, S, M	Instantaneous	(a pinch of dust and a few drops of water)A hail of rock-hard ice pounds to the ground in a 20-foot-radius, 40-foot-high cylinder centered on a point within range. Each creature in the cylinder must make a Dexterity saving throw. A creature takes 2d8 bludgeoning damage and 4d6 cold damage on a failed save, or half as much damage on a successful one.<br> Hailstones turn the storm's area of effect into difficult terrain until the end of your next turn. At Higher Levels: When you cast this spell using a spell slot of 5th level or higher, the bludgeoning damage increases by 1d8 for each slot level above 4th.		
Fighter (Eldritch Knight)	4	Otiluke's Resilient Sphere	4th level Evocation	1 action	30 feet	V, S, M	Concentration, up to 1 minute	(a hemispherical piece of clear crystal and a matching hemispherical piece of gum arabic)A sphere of shimmering force encloses a creature or object of Large size or smaller within range. An unwilling creature must make a Dexterity saving throw. On a failed save, the creature is enclosed for the duration.<br> Nothing, not physical objects, energy, or other spell effects, can pass through the barrier, in or out, though a creature in the sphere can breathe there. The sphere is immune to all damage, and a creature or object inside can't be damaged by attacks or effects originating from outside, nor can a creature inside the sphere damage anything outside it. The sphere is weightless and just large enough to contain the creature or object inside. An enclosed creature can use its action to push against the sphere's walls and thus roll the sphere at up to half the creature's speed. Similarly, the globe can be picked up and moved by other creatures. A disintegrate spell targeting the globe destroys it without harming anything inside it.		
Fighter (Eldritch Knight)	4	Wall of Fire	4th level Evocation	1 action	120 feet	V, S, M	Concentration, up to 1 minute	(a small piece of phosphorus)You create a wall of fire on a solid surface within range. You can make the wall up to 60 feet long, 20 feet high, and 1 foot think, or a ringed wall up to 20 feet in diameter, 20 feet high, and 1 foot think. The wall is opaque and lasts for the duration.<br> When the wall appears, each creature within its area must make a Dexterity saving throw. On a failed save, a creature takes 5d8 fire damage, or half as much damage on a successful save. One side of the wall, selected by you when you cast this spell, deals 5d8 fire damage to each creature that ends its turn within 10 feet of that side or inside the wall. A creature takes the same damage when it enters the wall for the first time on a turn or ends its turn there. The other side of the wall deals no damage. At Higher Levels: When you cast this spell using a spell slot of 5th level or higher, the damage increases by 1d8 for each slot level above 4th.		
