Class	Level	Name	School	Casting Time	Range	Components	Duration	Description
Rogue (Arcane Trickster)	3	Fear	3rd level Illusion	1 action	Self (30-foot cone)	V, S, M	Concentration, up to 1 minute	(a white feather or the heart of a hen)You project a phantasmal image of a creature's worst fears. Each creature in a 30-foot cone must succeed on a Wisdom saving throw or drop whatever it is holding and become frightened for the duration.<br> While frightened by this spell, a creature must take the Dash action and move away from you by the safest available route on each of its turns, unless there is nowhere to move. If the creature ends its turn in a location where it doesn't have line of sight to you, the creature can make a Wisdom saving throw. On a successful save, the spell ends for that creature.
Rogue (Arcane Trickster)	3	Hypnotic Pattern	3rd level Illusion	1 action	120 feet	S, M	Concentration, up to 1 minute	(a glowing stick of incense or a crystal vial filled with phosphorescent material)You create a twisting pattern of colors that weaves through the air inside a 30-foot cube within range. The pattern appears for a moment and vanishes. Each creature in the area who sees the pattern must make a Wisdom saving throw. On a failed save, the creature becomes charmed for the duration. While charmed by this spell, the creature is incapacitated and has a speed of 0.<br> The spell ends for an affected creature if it takes any damage or if someone else uses an action to shake the creature out of its stupor.
Rogue (Arcane Trickster)	3	Major Image	3rd level Illusion	1 action	120 feet	V, S, M	Concentration, up to 10 minutes	(a bit of fleece)You create the image of an object, a creature, or some other visible phenomenon that is no larger than a 20-foot cube. The image appears at a spot that you can see within range and lasts for the duration. It seems completely real, including sounds, smells, and temperature appropriate to the thing depicted. You can't create sufficient heat or cold to cause damage, a sound loud enough to deal thunder damage or deafen a creature, or a smell that might sicken a creature (like a troglodyte's stench).<br> As long as you are within range of the illusion, you can use your action to cause the image to move to any other spot within range. As the image changes location, you can alter its appearance so that its movements appear natural for the image. For example, if you create an image of a creature and move it, you can alter the image so that it appears to be walking. Similarly, you can cause the illusion to make different sounds at different times, even making it carry on a conversation, for example. Physical interaction with the image reveals it to be an illusion, because things can pass through it. A creature that uses its action to examine the image can determine that it is an illusion with a successful Intelligence (Investigation) check against your spell save DC. If a creature discerns the illusion for what it is, the creature can see through the image, and its other sensory qualities become faint to the creature. At Higher Levels: When you cast this spell using a spell slot of 6th level or higher, the spell lasts until dispelled, without requiring your concentration.
Rogue (Arcane Trickster)	3	Phantom Steed (ritual)	3rd level Illusion	1 minute	30 feet	V, S	1 hour	A Large quasi-real, horse-like creature appears on the ground in an unoccupied space of your choice within range. You decide the creature's appearance, but it is equipped with a saddle, bit, and bridle. Any of the equipment created by the spell vanishes in a puff of smoke if it is carried more than 10 feet away from the steed.<br> For the duration, you or a creature you choose can ride the steed. The creature uses the statistics for a riding horse, except it has a speed of 100 feet and can travel 10 miles in an hour, or 13 miles at a fast pace. When the spell ends, the steed gradually fades, giving the rider 1 minute to dismount. The spell ends if you use an action to dismiss it or if the steed takes any damage.
Rogue (Arcane Trickster)	4	Confusion	4th level Enchantment	1 action	90 feet	V, S, M	Concentration, up to 1 minute	(three nut shells)This spell assaults and twists creatures' minds, spawning delusions and provoking uncontrolled actions. Each creature in a 10-foot-radius sphere centered on a point you choose within range must succeed on a Wisdom saving throw when you cast this spell or be affected by it.<br> An affected target can't take reactions and must roll a d10 at the start of each of its turns to determine its behavior for that turn. 1: The creature uses all its movement to move in a random direction. To determine the direction, roll a d8 and assign a direction to each die face. The creature doesn't take an action this turn. 2-6: The creature doesn't move or take actions this turn. 7-8: The creature uses its action to make a melee attack against a randomly determined creature within its reach. If there is no creature within its reach, the creature does nothing this turn. 9-10: The creature can act and move normally. At the end of its turns, an affected target can make a Wisdom saving throw. If it succeeds, this effect ends for that target. At Higher Levels: When you cast this spell using a spell slot of 5th level or higher, the radius of the sphere increases by 5 feet for each slot above 4th.
Rogue (Arcane Trickster)	4	Greater Invisibility	4th level Illusion	1 action	Touch	V, S	Concentration, up to 1 minute	You or a creature you touch becomes invisible until the spell ends. Anything the target is wearing or carrying is invisible as long as it is on the target's person.
Rogue (Arcane Trickster)	4	Hallucinatory Terrain	4th level Illusion	10 minutes	300 feet	V, S, M	24 hours	(a stone, a twig, and a bit of green plant)You make natural terrain in a 150-foot cube in range look, sound, and smell like some other sort of natural terrain. Thus, open fields or a road can be made to resemble a swamp, hill, crevasse, or some other difficult or impassable terrain. A pond can be made to seem like a grassy meadow, a precipice like a gentle slope, or a rock-strewn gully like a wide and smooth road. Manufactured structures, equipment, and creatures within the area aren't changed in appearance.<br> The tactile characteristics of the terrain are unchanged, so creatures entering the area are likely to see through the illusion. If the difference isn't obvious by touch, a creature carefully examining the illusion can attempt an Intelligence (Investigation) check against your spell save DC to disbelieve it. A creature who discerns the illusion for what it is, sees it as a vague image superimposed on the terrain.
Rogue (Arcane Trickster)	4	Phantasmal Killer	4th level Illusion	1 action	120 feet	V, S	Concentration, up to 1 minute	You tap into the nightmares of a creature you can see within range and create an illusory manifestation of its deepest fears, visible only to that creature. The target must make a Wisdom saving throw. On a failed save, the target becomes frightened for the duration. At the end of each of the target's turns before the spell ends, the target must succeed on a Wisdom saving throw or take 4d10 psychic damage. On a successful save, the spell ends.<br> At Higher Levels: When you cast this spell using a spell slot of 5th level or higher, the damage increases by 1d10 for each slot level above 4th.