Class	Level	Name	School	Casting Time	Range	Components	Duration	Description
Rogue (Arcane Trickster)	0	Acid Splash	Conjuration cantrip	1 action	60 feet	V, S	Instantaneous	You hurl a bubble of acid. Choose one creature within range, or choose two creatures within range that are within 5 feet of each other. A target must succeed on a Dexterity saving throw or take 1d6 acid damage.<br> This spells damage increases by 1d6 when you reach 5th Level (2d6), 11th level (3d6) and 17th level (4d6).
Rogue (Arcane Trickster)	0	Blade Ward	Abjuration cantrip	1 action	Self	V, S	1 round	You extend your hand and trace a sigil of warding in the air. Until the end of your next turn, you have resistance against bludgeoning, piercing, and slashing damage dealt by weapon attacks.
Rogue (Arcane Trickster)	0	Chill Touch	Necromancy cantrip	1 action	120 feet	V, S	1 round	You create a ghostly, skeletal hand in the space of a creature within range. Make a ranged spell attack against the creature to assail it with the chill of the grave. On a hit, the target takes 1d8 necrotic damage, and it can't regain hit points until the start of your next turn. Until then, the hand clings to the target.<br> If you hit an undead target, it also has disadvantage on attack rolls against you until the end of your next turn. This spell's damage increases by 1d8 when you reach 5th level (2d8), 11th level (3d8), and 17th level (4d8).
Rogue (Arcane Trickster)	0	Dancing Lights	Evocation cantrip	1 action	120 feet	V, S, M	Concentration, up to 1 minute	You create up to four torch-sized lights within range, making them appear as torches, lanterns, or glowing orbs that hover in the air for the duration. You can also combine the four lights into one glowing vaguely humanoid form of Medium size. Whichever form you choose, each light sheds dim light in a 10-foot radius.<br> As a bonus action on your turn, you can move the lights up to 60 feet to a new spot within range. A light must be within 20 feet of another light created by this spell, and a light winks out if it exceeds the spell's range.
Rogue (Arcane Trickster)	0	Fire Bolt	Evocation cantrip	1 action	120 feet	V, S	Instantaneous	You hurl a mote of fire at a creature or object within range. Make a ranged spell attack against the target. On a hit, the target takes 1d10 fire damage. A flammable object hit by this spell ignites if it isn't being worn or carried.<br> This spell's damage increases by 1d10 when you reach 5th level (2d10), 11th level (3d10), and 17th level (4d10).
Rogue (Arcane Trickster)	0	Friends	Enchantment  cantrip	1 action	Self	S, M	Concentration, up to 1 minute	For the duration, you have advantage on all Charisma checks directed at one creature of your choice that isn't hostile toward you. When the spell ends, the creature realizes that you used magic to influence its mood and becomes hostile toward you. A creature prone to violence might attack you. Another creature might seek retribution in other ways (at the DM's discretion), depending on the nature of your interaction with it.
Rogue (Arcane Trickster)	0	Light	Evocation cantrip	1 action	Touch	V, M	1 hour	(a firefly or phosphorescent moss)You touch one object that is no larger than 10 feet in any dimension. Until the spell ends, the object sheds bright light in a 20-foot radius and dim light for an additional 20 feet. The light can be colored as you like. Completely covering the object with something opaque blocks the light. The spell ends if you cast it again or dismiss it as an action.<br> If you target an object held or worn by a hostile creature, that creature must succeed on a Dexterity saving throw to avoid the spell.
Rogue (Arcane Trickster)	0	Mage Hand	Conjuration cantrip	1 action	30 feet	V, S	1 minute	A spectral, floating hand appears at a point you choose within range. The hand lasts for the duration or until you dismiss it as an action. The hand vanishes if it is ever more than 30 feet away from you or if you cast this spell again.<br> You can use your action to control the hand. You can use the hand to manipulate an object, open an unlocked door or container, stow or retrieve an item from an open container, or pour the contents out of a vial. You can move the hand up to 30 feet each time you use it. The hand can't attack, activate magical items, or carry more than 10 pounds.
Rogue (Arcane Trickster)	0	Mending	Transmutation cantrip	1 minute	Touch	V, S, M	Instantaneous	(two lodestones)This spell repairs a single break or tear in an object you touch, such as broken chain link, two halves of a broken key, a torn clack, or a leaking wineskin. As long as the break or tear is no larger than 1 foot in any dimension, you mend it, leaving no trace of the former damage.<br> This spell can physically repair a magic item or construct, but the spell can't restore magic to such an object.
Rogue (Arcane Trickster)	0	Message	Transmutation cantrip	1 action	120 feet	V, S, M	1 round	(a short piece of copper wire)You point your finger toward a creature within range and whisper a message. The target (and only the target) hears the message and can reply in a whisper that only you can hear.<br> You can cast this spell through solid objects if you are familiar with the target and know it is beyond the barrier. Magical silence, 1 foot of stone, 1 inch of common metal, a thin sheet of lead, or 3 feet of wood blocks the spell. The spell doesn't have to follow a straight line and can travel freely around corners or through openings.
Rogue (Arcane Trickster)	0	Minor Illusion	Illusion cantrip	1 action	30 feet	S, M	1 minute	You create a sound or an image of an object within range that lasts for the duration. The illusion also ends if you dismiss it as an action or cast this spell again.<br> If you create a sound, its volume can range from a whisper to a scream. It can be your voice, someone else's voice, a lion's roar, a beating of drums, or any other sound you choose. The sound continues unabated throughout the duration, or you can make discrete sounds at different times before the spell ends. If you create an image of an object - such as a chair, muddy footprints, or a small chest - it must be no larger than a 5-foot cube. The image can't create sound, light, smell, or any other sensory effect. Physical interaction with the image reveals it to be an illusion, because things can pass through it. If a creature uses its action to examine the sound or image, the creature can determine that it is an illusion with a successful Intelligence (Investigation) check against your spell save DC. If a creature discerns the illusion for what it is, the illusion becomes faint to the creature.
Rogue (Arcane Trickster)	0	Poison Spray	Conjuration cantrip	1 action	10 feet	V, S	Instantaneous	You extend your hand toward a creature you can see within range and project a puff of noxious gas from your palm. The creature must succeed on a Constitution saving throw or take 1d12 poison damage.<br> This spell's damage increases by 1d12 when you reach 5th level (2d12), 11th level (3d12), and 17 level (4d12).
Rogue (Arcane Trickster)	0	Prestidigitation	Transmutation cantrip	1 action	10 feet	V, S	Up to 1 hour	This spell is a minor magical trick that novice spellcasters use for practice. You create one of the following magical effects within range.<br> • You create an instantaneous, harmless sensory effect, such as a shower of sparks, a puff of wind, faint musical notes, or an odd odor. • You instantaneously light or snuff out a candle, a torch, or a small campfire. • You instantaneously clean or soil an object no larger than 1 cubic foot. • You chill, warm, or flavor up to 1 cubic foot of nonliving material for 1 hour. • You make a color, a small mark, or a symbol appear on an object or a surface for 1 hour. • You create a nonmagical trinket or an illusory image that can fit in your hand and that lasts until the end of your next turn. If you cast this spell multiple times, you can have up to three of its non-instantaneous effects active at a time, and you can dismiss such an effect as an action.
Rogue (Arcane Trickster)	0	Ray of Frost	Evocation cantrip	1 action	60 feet	V, S	Instantaneous	A frigid beam of blue-white light streaks toward a creature within range. Make a ranged spell attack against the target. On a hit, it takes 1d8 cold damage, and its speed is reduced by 10 feet until the start of your next turn.<br> The spell's damage increases by 1d8 when you reach 5th level (2d8), 11th level (3d8), and 17th level (4d8).
Rogue (Arcane Trickster)	0	Shocking Grasp	Evocation cantrip	1 action	Touch	V, S	Instantaneous	Lightning springs from your hand to deliver a shock to a creature you try to touch. Make a melee spell attack against the target. You have advantage on the attack roll if the target is wearing armor made of metal. On a hit, the target takes 1d8 lightning damage, and it can't take reactions until the start of its next turn.<br> The spell's damage increases by 1d8 when you reach 5th level (2d8), 11th level (3d8), and 17th level (4d8).
Rogue (Arcane Trickster)	0	True Strike	Divination cantrip	1 action	30 feet	S	Concentration, up to 1 round	You extend your hand and point a finger at a target in range. Your magic grants you a brief insight into the target's defenses. On your next turn, you gain advantage on your first attack roll against the target, provided that this spell hasn't ended.
Rogue (Arcane Trickster)	1	Charm Person	1st level Enchantment	1 action	30 feet	V, S	1 hour	You attempt to charm a humanoid you can see within range. It must make a Wisdom saving throw, and does so with advantage if you or your companions are fighting it. If it fails the saving throw, it is charmed by you until the spell ends or until you or your companions do anything harmful to it. The charmed creature regards you as a friendly acquaintance. When the spell ends, the creature knows it was charmed by you.<br> At Higher Levels: When you cast this spell using a spell slot of 2nd level or higher, you can target one additional creature for each slot level above 1st. The creatures must be within 30 feet of each other when you target them.
Rogue (Arcane Trickster)	1	Sleep	1st level Enchantment	1 action	90 feet	V, S, M	1 minute	(a pinch of find sand, rose petals, or a cricket)This spell sends creatures into a magical slumber. Roll 5d8, the total is how many hit points of creatures this spell can affect. Creatures within 20 feet of a point you choose within range are affected in ascending order of their current hit points (ignoring unconscious creatures).<br> Starting with the creature that has the lowest current hit points, each creature affected by this spell falls unconscious until the spell ends, the sleeper takes damage, or someone uses an action to shake or slap the sleeper awake. Subtract each creature's hit points from the total before moving on to the creature with the next lowest hit points. A creature's hit points must be equal to or less than the remaining total for that creature to be affected. Undead and creatures immune to being charmed aren't affected by this spell. At Higher Levels: When you cast this spell using a spell slot of 2nd level or higher, roll an additional 2d8 for each slot level above 1st.
Rogue (Arcane Trickster)	1	Tasha's Hideous Laughter	1st level Enchantment	1 action	30 feet	V, S, M	Concentration, up to 1 minute	(tiny tarts and a feather that waved in the air)A creature of your choice that you can see within range perceives everything as hilariously funny and falls into fits of laugher if this spell affects it. The target must succeed on a Wisdom saving throw of fall prone, becoming incapacitated and unable to stand up for the duration. A creature with an Intelligence score of 4 or less isn't affected.<br> At the end of each of its turns, and each time it takes damage, the target can make another Wisdom saving throw. The target has advantage on the saving throw if it's triggered by damage. On a success, the spell ends.
Rogue (Arcane Trickster)	1	Color Spray	1st level Illusion	1 action	Self (15-foot cone)	V, S, M	1 round	(a pinch of powder or sand that is colored red, yellow, and blue)A dazzling array of flashing, colored light springs from your hand. Roll 6d10, the total is how many hit points of creatures this spell can effect. Creatures in a 15-foot cone originating from you are affected in ascending order of their current hit points (ignoring unconscious creatures and creatures that can't see).<br> Starting with the creature that has the lowest current hit points, each creature affected by this spell is blinded until the spell ends. Subtract each creature's hit points from the total before moving on to the creature with the next lowest hit points. A creature's hit points must be equal to or less than the remaining total for the creature to be affected. At Higher Levels: When you cast this spell using a spell slot of 2nd level or higher, roll an additional 2d10 for each slot level above 1st.
Rogue (Arcane Trickster)	1	Disguise Self	1st level Illusion	1 action	Self	V, S	1 hour	You make yourself, including your clothing, armor, weapons, and other belongings on your person, look different until the spell ends or until you use your action to dismiss it. You can seem 1 foot shorter or taller and can appear thin, fat, or in between. You can't change your body type, so you must adopt a form that has the same basic arrangement of limbs. Otherwise, the extent of the illusion is up to you.<br> The changes wrought by this spell fail to hold up to physical inspection. For example, if you use this spell to add a hat to your outfit, objects pass through the hat, and anyone who touches it would feel nothing or would feel your head and hair. If you use this spell to appear thinner than you are, the hand of someone who reaches out to touch you would bump into you while it was seemingly still in midair. To discern that you are disguised, a creature can use its action to inspect your appearance and must succeed on an Intelligence (Investigation) check against your spell save DC.
Rogue (Arcane Trickster)	1	Illusory Script (ritual)	1st level Illusion	1 minute	Touch	S, M	10 days	(a lead-based ink worth at least 10 gp, which the spell consumes)You write on parchment, paper, or some other suitable writing material and imbue it with a potent illusion that lasts for the duration.<br> To you and any creatures you designate when you cast the spell, the writing appears normal, written in your hand, and conveys whatever meaning you intended when you wrote the text. To all others, the writing appears as if it were written in an unknown or magical script that is unintelligible. Alternatively, you can cause the writing to appear to be an entirely different message, written in a different hand and language, though the language must be one you know. Should the spell be dispelled, the original script and the illusion both disappear. A creature with truesight can read the hidden message.
Rogue (Arcane Trickster)	1	Silent Image	1st level Illusion	1 action	60 feet	V, S, M	Concentration, up to 10 minute	(a bit of fleece)You create the image of an object, a creature, or some other visible phenomenon that is no larger than a 15-foot cube. The image appears at a spot within range and lasts for the duration. The image is purely visual, it isn't accompanied by sound, smell, or other sensory effects.<br> You can use your action to cause the image to move to any spot within range. As the image changes location, you can alter its appearance so that its movements appear natural for the image. For example, if you create an image of a creature and move it, you can alter the image so that it appears to be walking. Physical interaction with the image reveals it to be an illusion, because things can pass through it. A creature that uses its action to examine the image can determine that it is an illusion with a successful Intelligence (Investigation) check against your spell save DC. If a creature discerns the illusion for what it is, the creature can see through the image.
Rogue (Arcane Trickster)	2	Crown of Madness	2nd level Enchantment	1 action	120 feet	V, S	Concentration, up to 1 minute	One humanoid of your choice that you can see within range must succeed on a Wisdom saving throw or become charmed by you for the duration. While the target is charmed in this way, a twisted crown of jagged iron appears on its head, and a madness glows in its eyes.<br> The charmed target must use its action before moving on each of its turns to make a melee attack against a creature other than itself that you mentally choose. The target can act normally on its turn if you choose no creature or if none are within its reach. On your subsequent turns, you must use your action to maintain control over the target, or the spell ends. Also, the target can make a Wisdom saving throw at the end of each of its turns. On a success, the spell ends.
Rogue (Arcane Trickster)	2	Hold Person	2nd level Enchantment	1 action	60 feet	V, S, M	Concentration, up to 1 minute	(a small, straight piece of iron)Choose a humanoid that you can see within range. The target must succeed on a Wisdom saving throw or be paralyzed for the duration. At the end of each of its turns, the target can make another Wisdom saving throw. On a success, the spell ends on the target.<br> At Higher Levels: When you cast this spell using a spell slot of 3rd level or higher, you can target on additional humanoid for each slot level above 2nd. The humanoids must be within 30 feet of each other when you target them.
Rogue (Arcane Trickster)	2	Suggestion	2nd level Enchantment	1 action	30 feet	V, M	Concentration, up to 8 hours	(a snake's tongue and either a bit of honeycomb or a drop of sweet oil)You suggest a course of activity (limited to a sentence or two) and magically influence a creature you can see within range that can hear and understand you. Creatures that can't be charmed are immune to this effect. The suggestion must be worded in such a manner as to make the course of action sound reasonable. Asking the creature to stab itself, throw itself onto a spear, immolate itself, or do some other obviously harmful act ends the spell.<br> The target must make a Wisdom saving throw. On a failed save, it purses the course of action you described to the best of its ability. The suggested course of action can continue for the entire duration. If the suggested activity can be completed in a shorter time, the spell ends when the subject finishes what it was asked to do. You can also specify conditions that will trigger a special activity during the duration. For example, you might suggest that a knight five her warhorse to the first beggar she meets. If the condition isn't met before the spell expires, the activity isn't preformed. If you or any of your companions damage the target, the spell ends.
Rogue (Arcane Trickster)	2	Blur	2nd level Illusion	1 action	Self	V	Concentration, up to 1 minute	Your body becomes blurred, shifting and wavering to all who can see you. For the duration, any creature has disadvantage on attack rolls against you. An attacker is immune to this effect if it doesn't rely on sight, as with blindsight, or can see through illusions, as with truesight.
Rogue (Arcane Trickster)	2	Invisibility	2nd level Illusion	1 action	Touch	V, S, M	Concentration, up to 1 hour	(an eyelash encased in gum arabic)A creature you touch becomes invisible until the spell ends. Anything the target is wearing or carrying is invisible as long as it is on the target's person. The spell ends for a target that attacks or casts a spell.<br> At Higher Levels: When you cast this spell using a spell slot of 3rd level or higher, you can target one additional creature for each slot level above 2nd.
Rogue (Arcane Trickster)	2	Magic Mouth (ritual)	2nd level Illusion	1 minute	30 feet	V, S, M	Until dispelled	(a small bit of honeycomb and jade dust worth at least 10 gp, which the spell consumes)You implant a message within an object in range, a message that is uttered when a trigger condition is met. Choose an object that you can see and that isn't being worn or carried by another creature. Then speak the message, which must be 25 words or less, though it can be delivered over as long as 10 minutes. Finally, determine the circumstance that will trigger the spell to deliver your message.<br> When that circumstance occurs, a magical mouth appears on the object and recites the message in your voice and at the same volume you spoke. If the object you chose has a mouth or something that looks like a mouth (for example, the mouth of a statue), the magical mouth appears there so that words appear to come from the object's mouth. When you cast this spell, you can have the spell end after it delivers its message, or it can remain and repeats its message whenever the trigger occurs. The triggering circumstance can be as general or as detailed as you like, though it must be based on visual or audible conditions that occur within 30 feet of the object. For example, you could instruct the mouth to speak when any creature moves within 30 feet of the object or when a silver bell rings within 30 feet of it.
Rogue (Arcane Trickster)	2	Mirror Image	2nd level Illusion	1 action	Self	V, S	1 minute	Three illusory duplicates of yourself appear in your space. Until the spell ends, the duplicates move with you and mimic your actions, shifting position so it's impossible to track which image is real. You can use your action to dismiss the illusory duplicates.<br> Each time a creature targets you with an attack during the spell's duration, roll a d20 to determine whether the attack instead targets one of your duplicates. If you have three duplicates, you must roll a 6 or higher to change the attack's target to a duplicate. With two duplicates, you must roll an 8 or higher. With one duplicate, you must roll an 11 or higher. A duplicate's AC equals 10 + your Dexterity modifier. If an attack hits a duplicate, the duplicate is destroyed. A duplicate can be destroyed only by an attack that hits it. It ignores all other damage and effects. The spell ends when all three duplicates are destroyed. A creature is unaffected by this spell if it can't see, if it relies on senses other than sight, such as blindsight, or if it can perceive illusions as false, as with truesight.
Rogue (Arcane Trickster)	2	Nystul's Magic Aura	2nd level Illusion	1 action	Touch	V, S, M	24 hours	(a small square of silk)You place an illusion on a creature or an object you touch so that divination spells reveal false information about it. The target can be a willing creature or an object that isn't being carried or worn by another creature.<br> When you cast the spell, choose one or both of the following effects. The effect lasts for the duration. If you cast this spell on the same creature or object every day for 30 days, placing the same effect on it each time, the illusion lasts until it is dispelled. False Aura: You change the way the target appears to spells and magical effects, such as detect magic, that detect magical auras. You can make a nonmagical object appear magical, a magical object appear nonmagical, or change the object's magical aura so that it appears to belong to a specific school of magic that you choose. When you use this effect on an object, you can make the false magic apparent to any creature that handles the item. Mask: You change the way the target appears to spells and magical effects that detect creature types, such as a paladin's Divine Sense or the trigger of a symbol spell. You choose a creature type and other spells and magical effects treat the target as if it were a creature of that type or of that alignment.
Rogue (Arcane Trickster)	2	Phantasmal Force	2nd level Illusion	1 action	60 feet	V, S, M	Concentration, up to 1 minute	(a bit of fleece)You craft an illusion that takes root in the mind of a creature that you can see within range. The target must make an Intelligence saving throw. On a failed save, you create a phantasmal object, creature, or other visible phenomenon of your choice that is no larger than a 10-foot cube and that is perceivable only to the target for the duration. This spell has no effect on undead or constructs.<br> The phantasm includes sound, temperature, and other stimuli, also evident only to the creature. The target can use its action to examine the phantasm with an Intelligence (Investigation) check against your spell save DC. If the check succeeds, the target realizes that the phantasm is an illusion, and the spell ends. While a target is affected by the spell, the target treats the phantasm as if it were real. The target rationalizes any illogical outcomes from interacting with the phantasm. For example, a target attempting to walk across a phantasmal bridge that spans a chasm falls once it steps onto the bridge. If the target survives the fall, it still believes that the bridge exists and comes up with some other explanation for its fall - it was pushed, it slipped, or a strong wind might have knocked it off. An affected target is so convinced of the phantasm's reality that it can even take damage from the illusion. A phantasm created to appear as a creature can attack the target. Similarly, a phantasm created to appear as fire, a pool of acid, or lava can burn the target. Each round on your turn, the phantasm can deal 1d6 psychic damage to the target if it is in the phantasm's area or within 5 feet of the phantasm, provided that the illusion is of a creature or hazard that could logically deal damage, such as by attacking. The target perceives the damage as a type appropriate to the illusion.
